植物大战僵尸中文版,益智休闲,2.7,PopCap,,1059af5f3874e77129ea3fed818f8c37,//wap1.gamedog.cn/small/game/yizhi/8361/zhiwudazhanjs_yxdog.apk,植物大战僵尸中文版安卓是一款PopCap开发的SLG塔防防御游戏，植物大战僵尸中文版游戏在安卓平台上很受欢迎，此作中文版唯一的防御方式还是要玩家栽种植物。游戏集成了即时战略、塔防御战和卡片收集等要素
世界征服者2,策略战棋,1.08,,,46f560c3d6b096c0d30ee10031254b35,http://wap1.gamedog.cn/big/game/celue/81788/worldconqueror2_an.apk,世界征服者2安卓版游戏中你将扮演一位将军去完成二战和冷战的诸多重要历史战役，世界征服者2安卓版中你会和当年的那些名将并肩战斗或者和他们决一胜负。在二战剧本中你可以参加轴心国阵营或者是同盟国阵营，当完成这些剧本后可以开启冷战剧本模式。
犬夜叉完结篇,动作跑酷,1.0.4,,,cf6f04683615b5baadf1ef148107d873,http://wap1.gamedog.cn/among/game/dongzuo/25196/qycwjp_1.0.4_gamedog.apk,犬夜叉完结篇安卓版是一款采用ARPG游戏模式火热华丽大作，犬夜叉完结篇下载快捷，犬夜叉完结篇安卓版游戏里玩家将扮演犬夜叉进行一系列的探险故事。故事讲述了穿梭于现代与
切割,益智休闲,0.8,,,1e44d1bc4c771e9dceead76db670b9e0,http://wap1.gamedog.cn/small/game/yizhi/1207/slice_slice_0_8_1.apk,切割安卓版是一款puzzle益智休闲类游戏，切割安卓版游戏里玩家将作为一个寻宝世家的后代，在整个家族为深埋的奇珍异宝探寻了数个世纪后，你最终找到了一张藏宝图。不幸的是，这张藏宝图被具有魔力的尘土覆盖着
功夫熊猫,策略战棋,24.2.24,,,a925c385de759f9e7bcbf1e020b305c1,http://wap1.gamedog.cn/big/game/sheji/1308/PandaHeroes_an.apk,"功夫熊猫安卓版讲述的是熊猫的故事，功夫熊猫安卓版游戏里突然到访的怪物,开始肆意破坏.熊猫村派出他们最强熊猫武器阻挡了怪物们袭击；怪物们被击退了,大家都在欢呼"
颜色填充,益智休闲,1.05,,,c755d15702e6603d8d0555f6e6d5c46f,http://wap1.gamedog.cn/small/game/qipai/21224/yansetianxhong_an.apk,颜色填充安卓版是一款有趣的益智游戏，颜色填充安卓版游戏画面色彩鲜明，并且玩法也很简单。就是需要玩家将分散的图形想办法把它们复原，前面的几个关卡比较简单，很快你就能找到窍门和感觉。
